[
  {
    "id": "https://www.instagram.com/reel/Db5JwFCN478/",
    "stype": 1,
    "PublishedOn": "0001-01-01T00:00:00Z",
    "BlueSkyPost": {
      "BskyURI": "",
      "BskyCID": "",
      "Description": "",
      "BskyProfileURI": "",
      "BskyProfile": "",
      "BskyPost": ""
    },
    "InstagramPost": {
      "URL": "https://www.instagram.com/reel/Db5JwFCN478/",
      "Description": "",
      "SvgPath": ""
    }
  }
]
